{
  "allocation_count": 4,
  "allocation_execution_trace_digest": "sha256:f048a1216e1a95d62b1d61a315fcf5a37637887828f8b332b16e2e5ea89a086f",
  "allocation_mode": "in_process_preallocated_numpy_slots",
  "allocations": [
    {
      "address_exposure": "not_exposed",
      "first_live_index": 0,
      "last_use_index": 1,
      "layout": "row_major",
      "memory_domain": "host_ram",
      "operation_index": 0,
      "operation_name": "left_projection",
      "planned_bytes": 64,
      "planned_dtype": "float32",
      "previous_tensor_name": null,
      "release_index": 1,
      "release_verification": "released_at_proven_last_use",
      "reuse_status": "first_slot_generation",
      "runtime_bytes": 128,
      "runtime_dtype": "float64",
      "shape": [
        4,
        4
      ],
      "slot_generation": 1,
      "slot_id": "slot_001",
      "status": "executed_and_verified",
      "tensor_name": "left_tmp",
      "write_verification": "exact_kernel_result"
    },
    {
      "address_exposure": "not_exposed",
      "first_live_index": 1,
      "last_use_index": 4,
      "layout": "row_major",
      "memory_domain": "host_ram",
      "operation_index": 1,
      "operation_name": "left_activation",
      "planned_bytes": 64,
      "planned_dtype": "float32",
      "previous_tensor_name": null,
      "release_index": 4,
      "release_verification": "released_at_proven_last_use",
      "reuse_status": "first_slot_generation",
      "runtime_bytes": 128,
      "runtime_dtype": "float64",
      "shape": [
        4,
        4
      ],
      "slot_generation": 1,
      "slot_id": "slot_002",
      "status": "executed_and_verified",
      "tensor_name": "left_out",
      "write_verification": "exact_kernel_result"
    },
    {
      "address_exposure": "not_exposed",
      "first_live_index": 2,
      "last_use_index": 3,
      "layout": "row_major",
      "memory_domain": "host_ram",
      "operation_index": 2,
      "operation_name": "right_projection",
      "planned_bytes": 64,
      "planned_dtype": "float32",
      "previous_tensor_name": "left_tmp",
      "release_index": 3,
      "release_verification": "released_at_proven_last_use",
      "reuse_status": "reused_after_release",
      "runtime_bytes": 128,
      "runtime_dtype": "float64",
      "shape": [
        4,
        4
      ],
      "slot_generation": 2,
      "slot_id": "slot_001",
      "status": "executed_and_verified",
      "tensor_name": "right_tmp",
      "write_verification": "exact_kernel_result"
    },
    {
      "address_exposure": "not_exposed",
      "first_live_index": 3,
      "last_use_index": 4,
      "layout": "row_major",
      "memory_domain": "host_ram",
      "operation_index": 3,
      "operation_name": "right_activation",
      "planned_bytes": 64,
      "planned_dtype": "float32",
      "previous_tensor_name": null,
      "release_index": 4,
      "release_verification": "released_at_proven_last_use",
      "reuse_status": "first_slot_generation",
      "runtime_bytes": 128,
      "runtime_dtype": "float64",
      "shape": [
        4,
        4
      ],
      "slot_generation": 1,
      "slot_id": "slot_003",
      "status": "executed_and_verified",
      "tensor_name": "right_out",
      "write_verification": "exact_kernel_result"
    }
  ],
  "allocator_contract": "runtime_allocator.trusted_simulator.v0",
  "artifact_status": "review_evidence",
  "blocked_execution_surfaces": [
    "backend_plugin_discovery",
    "device_access",
    "dynamic_import",
    "dynamic_library_loading",
    "generated_artifact_execution",
    "jit_execution",
    "network_access",
    "subprocess_execution",
    "allocator_plugin_loading",
    "device_allocation",
    "external_allocator_calls",
    "memory_mapping",
    "pointer_or_address_exposure",
    "runtime_handle_serialization",
    "unbounded_memory_pool"
  ],
  "budget_interpretation": "planned_float32_budget_separate_from_float64_executor_storage",
  "evidence_contract": "runtime_allocation.materialized_trusted_simulator.v0",
  "external_artifacts": "forbidden",
  "graph_name": "runtime_buffer_lifetime",
  "handle_policy": "not_exposed",
  "kernel_temporary_policy": "excluded_from_allocator_memory_claim",
  "materialization_policy": "preallocate_write_release_reuse",
  "materialization_scope": "trusted_host_ram_row_major_slots_only",
  "native_allocator_claim": "not_claimed",
  "operation_count": 4,
  "output_metadata_digest": "sha256:765238b5a25b1e10b0fe0a9e416c38d7a32b9b2cb618d6930a3ba1abb365e2cd",
  "performance_claim": "not_measured",
  "physical_memory_claim": "host_process_storage_only",
  "planned_reserved_bytes": 192,
  "raw_value_policy": "omitted_by_policy",
  "reference_correctness_digest": "sha256:c1968511a80480720a01c2573fe48495e7fc9d3baa0be6c63ec38b5f817b9d1a",
  "reference_correctness_passed": true,
  "release_count": 4,
  "retained_tensor_record_count": 6,
  "retention_policy": "external_inputs_and_terminal_output_snapshots_only",
  "reuse_event_count": 1,
  "reused_slot_count": 1,
  "runtime_execution_trace_digest": "sha256:54d503a8a46a890abf23f0c17af1c162a2aa264fabd89608a8a91fac3e9ce9a8",
  "runtime_reserved_bytes": 384,
  "runtime_reuse_savings_bytes": 128,
  "runtime_unreused_tensor_bytes": 512,
  "schema_version": "tuc.runtime_materialized_allocation_report.v0",
  "slot_count": 3,
  "slots": [
    {
      "allocation_kind": "reused",
      "layout": "row_major",
      "memory_domain": "host_ram",
      "planned_bytes": 64,
      "planned_dtype": "float32",
      "runtime_bytes": 128,
      "runtime_dtype": "float64",
      "shape": [
        4,
        4
      ],
      "slot_id": "slot_001",
      "status": "preallocated",
      "tensor_count": 2
    },
    {
      "allocation_kind": "exclusive",
      "layout": "row_major",
      "memory_domain": "host_ram",
      "planned_bytes": 64,
      "planned_dtype": "float32",
      "runtime_bytes": 128,
      "runtime_dtype": "float64",
      "shape": [
        4,
        4
      ],
      "slot_id": "slot_002",
      "status": "preallocated",
      "tensor_count": 1
    },
    {
      "allocation_kind": "exclusive",
      "layout": "row_major",
      "memory_domain": "host_ram",
      "planned_bytes": 64,
      "planned_dtype": "float32",
      "runtime_bytes": 128,
      "runtime_dtype": "float64",
      "shape": [
        4,
        4
      ],
      "slot_id": "slot_003",
      "status": "preallocated",
      "tensor_count": 1
    }
  ],
  "source_admission_digest": "sha256:aad1a5938234aa4269272e681d63c5e5b08aea7ac607d4ffb643d008a5e076b6",
  "source_allocation_plan_digest": "sha256:45f693be572dd776078e7fb0211b1562a48c4d50ad62b55e7f680975b36f2ede",
  "source_memory_budget_digest": "sha256:1942c0746262f79391805613cf42836b84a167540fc3a879dbbfd9317f3377ad",
  "source_receipt_digest": "sha256:72dd23f73383d7283222f439bde0f4210f83ed4f9f91a0f51be2a81e7ed96187",
  "source_reconciliation_digest": "sha256:422eee9e47dc1c2a6e55c00a73dba3c8a3d2cd65c57e1a9bf2926325dbabbcd5",
  "source_request_manifest_digest": "sha256:e4ece2b0e7a9811062744f2d924a1a68c12844df779410dbe84399dd48e6e636",
  "status": "passed",
  "terminal_output_count": 2,
  "terminal_output_snapshot_bytes": 256,
  "write_mode": "trusted_kernel_result_copied_into_slot"
}
